{
  "$schema": "http://json-schema.org/draft-07/schema#",
  "type": "object",
  "required": ["task_id", "average_score", "decision"],
  "properties": {
    "task_id": {"type": "string"},
    "run_id": {"type": "string"},
    "average_score": {"type": "number", "minimum": 0, "maximum": 1},
    "dimension_scores": {
      "type": "object",
      "additionalProperties": {"type": "number"}
    },
    "decision": {
      "type": "string",
      "enum": ["approve", "reject", "hold"]
    },
    "blocking_cases": {
      "type": "array",
      "items": {
        "type": "object",
        "properties": {
          "dimension": {"type": "string"},
          "reason": {"type": "string"},
          "severity": {"type": "string", "enum": ["critical", "major", "minor"]}
        }
      }
    },
    "risk_level": {
      "type": "string",
      "enum": ["low", "medium", "high"]
    },
    "evaluated_at": {"type": "string", "format": "date-time"}
  }
}
